{
  "request_id": "req-2026-10-18-0001",
  "capability_id": "CAP-MEA-02",
  "status": "OK",
  "label": "ADJACENT",
  "probabilities": null,
  "abstention": false,
  "evidence_refs": [
    "store/raw/cand-m1-0001.txt#L1-L40"
  ],
  "model_profile_id": "MODEL-PROFILE-STUB-AGENT",
  "model_revision": "stub-v1",
  "adapter_version": "0.1.0",
  "calibration_profile_id": null,
  "judgment_language": "en",
  "input_representation": "ORIGINAL_SOURCE_TEXT",
  "translation_ref": null,
  "inference_metadata_ref": "trace/req-2026-10-18-0001/invoke",
  "reason_code": null,
  "contract_version": "1.1"
}
